{
  "formatVersion": "jiandu.backup-metadata/v1alpha1",
  "storeId": "7d7c3ef0-332e-43e8-b2c9-b96f6c107a32",
  "transactionId": "6400d08e-41ab-478f-a8c7-150542f3f2b3",
  "baseSnapshot": {
    "storeRevision": 0,
    "auditSequence": 0
  },
  "targetSnapshot": {
    "storeRevision": 4,
    "auditSequence": 1
  },
  "sourceStoreId": "019d2a4a-7b00-7000-8000-000000000019",
  "sourceSnapshot": {
    "storeRevision": 4,
    "auditSequence": 4
  },
  "bundleDigest": "sha256:72cdb84afa2d2c830080610c6dac8a895bf20e3301ff65fd8adad005dbebf926",
  "planDigest": "sha256:835852da5a1b92732e3d689c547a95e85fbddd6ac02c1cfe80db72ecb72884fd",
  "recordCount": 2,
  "tombstoneCount": 1,
  "digest": "sha256:a0a58a6b8b14b3e88fe2c18602353ea76ad020080cb23dce68b00de04d24574c"
}
